{
  "$schema": "https://changesaga.dev/schema/v5/relation-repin.schema.json",
  "version": 5,
  "id": "r2",
  "relation": "urn:change-saga:app:relation:criterion-identity-addresses-rewording",
  "from_content_digest": "sha256:9dd9a9ce2344dc7c51592357f8eea656deb4f96c813cade02a96993f70af9105",
  "rationale": "The relation remains accurate after visual legibility edits; the requirement and semantic design node are unchanged.",
  "created_at": "2026-09-21T04:57:24.613531Z"
}
