{
  "$schema": "https://changesaga.dev/schema/v5/relation-repin.schema.json",
  "version": 5,
  "id": "r2",
  "relation": "urn:change-saga:change-saga:relation:quality-outcome-explains-required-proof",
  "to_revision": "urn:change-saga:change-saga:story:criterion-quality-readiness:revision:r2",
  "rationale": "The refined wording still requires a current passed outcome and preserves the rule that a current failure outranks another pass.",
  "created_at": "2026-09-23T16:44:55.114037Z"
}
